{"apiVersion":"eak/v0.2","kind":"ExecutionGraph","metadata":{"id":"paper.legal.logical","version":"0.2.0","displayName":"legal logical"},"spec":{"graphType":"logical","entrypoints":["normalize"],"nodes":[{"id":"normalize","kind":"capability","capability":{"id":"legal.document.normalize","version":"1.0.0"}},{"id":"retrieve","kind":"capability","capability":{"id":"legal.authority.retrieve","version":"1.0.0"}},{"id":"analyze","kind":"capability","capability":{"id":"legal.contract.analyze","version":"1.0.0"}},{"id":"lawyer_review","kind":"approval","approvalProfile":"legal.lawyer-review"},{"id":"report","kind":"transform"}],"edges":[{"from":"normalize","to":"retrieve","on":"success"},{"from":"retrieve","to":"analyze","on":"success"},{"from":"analyze","to":"lawyer_review","on":"success"},{"from":"lawyer_review","to":"report","on":"success"}],"termination":{"successStates":["SUCCEEDED"],"failureStates":["FAILED","CANCELLED"]}}}