{"apiVersion":"eak/v0.2","kind":"ExecutionGraph","metadata":{"id":"paper.medical.logical.compiled","version":"0.2.0","displayName":"medical physical"},"spec":{"graphType":"physical","entrypoints":["parse"],"nodes":[{"id":"parse","kind":"capability","capability":{"id":"document.parse","version":"1.0.0"},"provider":{"id":"provider.docling","version":"1.0.0"}},{"id":"classify","kind":"capability","capability":{"id":"medical.imaging.chest_xray.classify","version":"1.0.0"},"provider":{"id":"provider.xray.local","version":"1.0.0"}},{"id":"clinician_review","kind":"approval","approvalProfile":"medical.clinician-review"},{"id":"render","kind":"transform"}],"edges":[{"from":"parse","to":"classify","on":"success"},{"from":"classify","to":"clinician_review","on":"success"},{"from":"clinician_review","to":"render","on":"success"}],"termination":{"successStates":["SUCCEEDED"],"failureStates":["FAILED","CANCELLED"]}}}