{"apiVersion":"eak/v0.2","kind":"ExecutionGraph","metadata":{"id":"paper.aec.logical","version":"0.2.0","displayName":"aec logical"},"spec":{"graphType":"logical","entrypoints":["parse_ifc"],"nodes":[{"id":"parse_ifc","kind":"capability","capability":{"id":"aec.ifc.parse","version":"1.0.0"}},{"id":"compliance","kind":"capability","capability":{"id":"aec.compliance.check","version":"1.0.0"}},{"id":"engineer_review","kind":"approval","approvalProfile":"aec.engineer-review"},{"id":"report","kind":"transform"}],"edges":[{"from":"parse_ifc","to":"compliance","on":"success"},{"from":"compliance","to":"engineer_review","on":"success"},{"from":"engineer_review","to":"report","on":"success"}],"termination":{"successStates":["SUCCEEDED"],"failureStates":["FAILED","CANCELLED"]}}}